query,result,inference_time,device
APICTA Awards là giải thưởng gì?,"
Giải thưởng CNTT châu Á-Thái Bình Dương (APICTA) là một sự kiện được tổ chức bởi Hiệp hội Phần mềm và CNTT Châu Á Thái Bình Dương (ASOCIO) nhằm ghi nhận các ứng dụng, sản phẩm, giải pháp, dịch vụ và giải pháp phần mềm xuất sắc của các quốc gia trong khu vực.",46.847224950790405,NVIDIA GeForce RTX 4050 Laptop GPU
Thông tin về ông Trương Gia Bình?,"
Ông Trương Gia Bình là Chủ tịch Hội đồng quản trị của Tập đoàn FPT từ năm 2006 đến 2011, theo thông tin được cung cấp.",20.869739055633545,NVIDIA GeForce RTX 4050 Laptop GPU
Tập đoàn FPT được thành lập như thế nào?,"
Tập đoàn FPT được thành lập vào ngày 13 tháng 4 năm1989 bởi ông Trương Đình Quảng, một cựu sinh viên Trường Đại học Bách khoa Điện tử Hà Nội.",26.364343881607056,NVIDIA GeForce RTX 4050 Laptop GPU
Ngành học nào phổ biến nhất tại đại học FPT?,"
Tại Đại học FPT, ngành học phổ biến nhất là Công nghệ thông tin, vì đây là ngành công nghệ chính mà trường tập trung phát triển và cung cấp nhân lực.",22.408303260803223,NVIDIA GeForce RTX 4050 Laptop GPU
"Sau khi tốt nghiệp Đại học FPT, sinh viên có thực sự là tìm được việc làm hay không?","
Đại học FPT đã giúp sinh viên có thể tìm được việc làm sau khi tốt nghiệp.",21.321263074874878,NVIDIA GeForce RTX 4050 Laptop GPU
Triết lý đào tạo của đại học FPT là gì?,"
Truyền thống giáo dục của Đại học FPT là ""Đào tạo là tổ chức và quản lý việc học tập của người học"", tập trung vào việc xây dựng mô hình của một trường đại học thế hệ mới, gắn liền với đào tạo theo thực tế và nhu cầu nhân lực của đất nước, cuối cùng góp phần đưa giáo dục Việt Nam lên ngang tầm với các nước trên thế giới.",39.303059577941895,NVIDIA GeForce RTX 4050 Laptop GPU
Học bổng tại đại học FPT được tính như thế nào?,"
Học bổng tại Đại học FPT được tính dựa trên kết quả học tập và thành tích của sinh viên. Mức học bổng dao động từ 10% đến 100%, với mức cao nhất là 100% dành cho sinh viên xuất sắc nhất. Ngoài ra, sinh viên cũng có thể đủ điều kiện nhận học bổng toàn phần miễn phí nếu họ đáp ứng các tiêu chí cụ thể.",40.95334339141846,NVIDIA GeForce RTX 4050 Laptop GPU
Ý nghĩa của logo FPT là gì?,"
Logo của Trường Đại học FPT thể hiện các giá trị cốt lõi của thương hiệu FPT, với ba màu sắc đặc trưng là cam, xanh lá cây và xanh dương đậm. Màu cam tượng trưng cho sự sáng tạo, sinh lực và chia sẻ cộng đồng, màu xanh lá cây đại diện cho sự bền vững, và màu xanh lam đại diện cho niềm tin và uy tín.",40.40245580673218,NVIDIA GeForce RTX 4050 Laptop GPU
Một ngày nên uống bao nhiêu nước?,"
Theo Hiệp hội Tim mạch Hoa Kỳ, một người nên uống khoảng 2-3 lít nước mỗi ngày, tùy thuộc vào các yếu tố như tuổi tác, cân nặng, mức độ hoạt động và khí hậu.",19.96246886253357,NVIDIA GeForce RTX 4050 Laptop GPU
Cái lược là cái gì?,"
Lược là một công cụ được sử dụng để gỡ rối và duy trì độ dài của tóc.",17.105499744415283,NVIDIA GeForce RTX 4050 Laptop GPU
Loại mèo nào đắt nhất thế giới?,"
Tôi không biết câu trả lời.",12.338719844818115,NVIDIA GeForce RTX 4050 Laptop GPU
Thuyết lượng tử ánh sáng là gì?,"
Tôi không biết câu trả lời.",17.04550814628601,NVIDIA GeForce RTX 4050 Laptop GPU
Vụ Nổ Lớn (Big Bang) có thực sự xảy ra?,"
Big Bang là một lý thuyết khoa học được chấp nhận rộng rãi, đề xuất rằng vũ trụ bắt đầu như thế nào. Nó mô tả sự hình thành của vũ trụ từ trạng thái nóng, dày đặc khoảng 13,8 tỷ năm trước đây. Lý thuyết này dựa trên một lượng lớn bằng chứng, bao gồm bức xạ nền vi sóng vũ trụ, cấu trúc quy mô lớn và sự phong phú của các nguyên tố ánh sáng.

Mặc dù lý thuyết Big Bang được chấp nhận rộng rãi, nhưng nó không được chứng minh tuyệt đối. Tuy nhiên, nó cung cấp một lời giải thích có thể kiểm chứng tốt cho các hiện tượng quan sát được trong vũ trụ. Các nhà khoa học liên tục nghiên cứu và hoàn thiện hiểu biết của họ về vũ trụ thông qua quan sát và thí nghiệm, vì vậy lý thuyết có thể được sửa đổi hoặc thay thế trong tương lai.",81.20233678817749,NVIDIA GeForce RTX 4050 Laptop GPU
Du hành thời gian có thực sự khả thi?,"
Tôi không biết câu trả lời.",12.986374378204346,NVIDIA GeForce RTX 4050 Laptop GPU
Âm nhạc có tác dụng như thế nào đối với con người?,"
Âm nhạc có thể có nhiều tác động khác nhau đối với con người, bao gồm:

1. Cảm xúc: Âm nhạc có thể gợi lên những cảm xúc và cảm giác khác nhau, như hạnh phúc, buồn bã, giận dữ hoặc bình tĩnh.

2. Sức khỏe: Nghiên cứu đã chỉ ra rằng âm nhạc có thể cải thiện sức khỏe thể chất bằng cách hạ huyết áp, giảm nhịp tim và giảm căng thẳng. Nó cũng có thể thúc đẩy sức khỏe tinh thần bằng cách giảm lo âu, cải thiện tâm trạng và nâng cao lòng tự trọng.

3. Gắn kết xã hội: Âm nhạc có thể tạo ra cảm giác cộng đồng và gắn kết giữa những người nghe, tham gia vào các hoạt động âm nhạc hoặc chia sẻ sở thích âm nhạc.

4. Động lực và tập trung: Âm nhạc có thể giúp mọi người tập trung và duy trì sự tỉnh táo, đặc biệt trong các nhiệm vụ đòi hỏi sự chú ý liên tục.

5. Học tập và trí nhớ: Âm nhạc có thể hỗ trợ việc học bằng cách cải thiện trí nhớ và khả năng ghi nhớ thông tin.

6. Thể chất và cảm giác: Âm nhạc có thể ảnh hưởng đến thể lực bằng cách tạo ra cảm giác di chuyển và phối hợp, cũng như tác động tới cảm giác của chúng ta về không gian và hình dáng.

7. Sự sáng tạo và biểu hiện: Âm nhạc có thể là một hình thức tự thể hiện bản thân, cho phép mọi người chia sẻ suy nghĩ, cảm xúc và kinh nghiệm của mình thông qua âm nhạc.

Tóm lại, âm nhạc có thể có tác động sâu sắc và đa diện đến cuộc sống của con người, ảnh hưởng đến cảm xúc, sức khỏe, kết nối xã hội, động lực, học tập, thể chất và sự sáng tạo.",153.13748002052307,NVIDIA GeForce RTX 4050 Laptop GPU
