query,result,inference_time,device
APICTA Awards là giải thưởng gì?,"
APICTA Awards là giải thưởng dành cho các sản phẩm, ứng dụng, giải pháp và dịch vụ CNTT xuất sắc trong khu vực Châu Á – Thái Bình Dương.",29.97090244293213,NVIDIA GeForce RTX 3060 Laptop GPU
Thông tin về ông Trương Gia Bình?,"
Không có thông tin nào về ông Trương Gia Bình được cung cấp.",14.464463472366333,NVIDIA GeForce RTX 3060 Laptop GPU
Tập đoàn FPT được thành lập như thế nào?,"
Tập đoàn FPT được thành lập vào năm 1984.",11.604795455932617,NVIDIA GeForce RTX 3060 Laptop GPU
Ngành học nào phổ biến nhất tại đại học FPT?,"
Ngành học phổ biến nhất tại Đại học FPT có lẽ là ngành Công nghệ thông tin, vì đây là một trong những ngành chính được đào tạo tại trường đại học. Ngoài ra, các ngành Kinh tế, Thiết kế đồ họa, Ngôn ngữ, Kiến trúc, Quản trị khách sạn và các nhóm ngành khác có liên quan cũng phổ biến.",49.30368518829346,NVIDIA GeForce RTX 3060 Laptop GPU
"Sau khi tốt nghiệp Đại học FPT, sinh viên có thực sự là tìm được việc làm hay không?","
Có, sinh viên Đại học FPT có tỷ lệ việc làm cao sau khi tốt nghiệp. Họ được chuẩn bị tốt với kiến thức và kinh nghiệm thực tế, giúp họ có thể tham gia vào thị trường lao động một cách tự tin.",36.239707708358765,NVIDIA GeForce RTX 3060 Laptop GPU
Triết lý đào tạo của đại học FPT là gì?,"
Triết lý đào tạo của Đại học FPT là ""đào tạo là tổ chức và quản trị việc tự học của người học"".",22.369234323501587,NVIDIA GeForce RTX 3060 Laptop GPU
Học bổng tại đại học FPT được tính như thế nào?,"
Học bổng tại Đại học FPT phụ thuộc vào chương trình hoặc chương trình cụ thể, vì vậy tôi không thể đưa ra một quy trình chung. Tuy nhiên, tôi có thể nói rằng có một số tiêu chí chung được sử dụng để đánh giá học sinh đủ điều kiện cho các học bổng này. Thông thường, các tiêu chí này bao gồm thành tích học tập, hoạt động ngoại khóa, đề xuất từ giáo viên hoặc người hướng dẫn, và sự phù hợp của học sinh với chương trình hoặc chương trình cụ thể.",71.9539647102356,NVIDIA GeForce RTX 3060 Laptop GPU
Ý nghĩa của logo FPT là gì?,"
Logo Trường Đại học FPT thể hiện những giá trị cốt lõi của thương hiệu FPT với ba màu đặc trưng là cam, xanh lá cây và xanh dương đậm. Màu cam tượng trưng cho sự sáng tạo, sinh lực và chia sẻ cộng đồng. Màu xanh lá cây đại diện cho sự phát triển bền vững, hài hòa và kiến thức. Màu xanh dương tượng trưng cho sự tin cậy, minh bạch và chuyên nghiệp.",60.04372453689575,NVIDIA GeForce RTX 3060 Laptop GPU
Một ngày nên uống bao nhiêu nước?,"
Số lượng chính xác người nên uống nước mỗi ngày thay đổi tùy thuộc vào các yếu tố như tuổi, cân nặng, mức độ hoạt động và khí hậu. Nói chung, người lớn nên uống khoảng 2-3 lít nước mỗi ngày, hoặc khoảng 2-3 lít nước mỗi ngày.",35.51706385612488,NVIDIA GeForce RTX 3060 Laptop GPU
Cái lược là cái gì?,"
Không biết.",7.880413293838501,NVIDIA GeForce RTX 3060 Laptop GPU
Loại mèo nào đắt nhất thế giới?,"
Tôi không có thông tin về mèo cụ thể, nhưng tôi có thể cung cấp thông tin về mèo đắt nhất trên thị trường. Theo báo cáo, một chú mèo Bengal có thể có giá lên đến 20.000 đô la. Giá có thể thay đổi tùy thuộc vào các yếu tố như giống, tuổi, giới tính và địa điểm.",47.70732069015503,NVIDIA GeForce RTX 3060 Laptop GPU
Thuyết lượng tử ánh sáng là gì?,"
Trong ngữ cảnh của Học kỳ 4 của chương trình đào tạo Công nghệ Ô tô số tại Đại học FPT, Thuyết Lượng tử Ánh sáng đề cập đến sự tích hợp các khái niệm và công nghệ Trí tuệ Nhân tạo vào phát triển phần mềm. Điều này liên quan đến việc sử dụng các thuật toán và mô hình dựa trên Trí tuệ Nhân tạo để tối ưu hóa và cải thiện quy trình phát triển phần mềm, cũng như áp dụng các kỹ thuật học máy và học sâu để phân tích và diễn giải dữ liệu. Mục tiêu là nâng cao hiệu quả, độ chính xác và hiệu suất của các quy trình phát triển phần mềm trong ngành công nghệ thông tin ô tô.",95.0984137058258,NVIDIA GeForce RTX 3060 Laptop GPU
Vụ Nổ Lớn (Big Bang) có thực sự xảy ra?,"
Big Bang là giả thuyết khoa học về nguồn gốc của vũ trụ, trong đó vũ trụ bắt đầu như một điểm nóng, dày đặc và sau đó mở rộng nhanh chóng. Giả thuyết này được hỗ trợ bởi một lượng lớn bằng chứng, bao gồm bức xạ nền vi sóng vũ trụ, cấu trúc quy mô lớn của vũ trụ và sự phong phú của các nguyên tố được tạo ra trong vũ trụ sơ khai.

Mặc dù Big Bang là một giả thuyết, nhưng nó được hỗ trợ rất mạnh mẽ bởi bằng chứng và được cộng đồng khoa học chấp nhận rộng rãi. Do đó, có lý khi nói rằng Big Bang đã xảy ra.",88.93721628189087,NVIDIA GeForce RTX 3060 Laptop GPU
Du hành thời gian có thực sự khả thi?,"
Không",6.429038763046265,NVIDIA GeForce RTX 3060 Laptop GPU
Âm nhạc có tác dụng như thế nào đối với con người?,"
Âm nhạc có thể có nhiều tác động khác nhau đối với con người, tùy thuộc vào sở thích cá nhân, trải nghiệm và mối liên kết cảm xúc của họ với âm nhạc. Một số tác động có thể bao gồm:

1. Cảm xúc và sự gắn kết cảm xúc: Âm nhạc có khả năng gợi lên những cảm xúc mạnh mẽ và có thể gợi lên những ký ức, trải nghiệm hoặc cảm giác cụ thể. Nó có thể mang lại cảm giác hạnh phúc, buồn bã, niềm vui, sự giận dữ hoặc bất kỳ cảm xúc nào khác. Âm nhạc cũng có thể tạo ra một cảm giác gắn kết với những trải nghiệm cảm xúc chung, cho phép mọi người kết nối với nhau qua những cảm xúc đó.

2. Trạng thái cảm giác: Âm nhạc có thể ảnh hưởng đến trạng thái cảm giác của một người, từ làm dịu tâm trí đến tăng cường năng lượng. Một số thể loại âm nhạc, như nhạc nhịp nhanh, có thể tăng nhịp tim và hô hấp, trong khi những thể loại khác, như nhạc cổ điển hoặc jazz, có thể thúc đẩy sự thư giãn.

3. Động lực và tập trung: Âm nhạc có thể ảnh hưởng đến hành vi và động lực. Một số người sử dụng âm nhạc để giúp họ tập trung hoặc làm việc hiệu quả hơn, trong khi những người khác có thể sử dụng âm nhạc để tăng động lực và năng lượng cho các hoạt động.

4. Sức khỏe và hạnh phúc: Âm nhạc có thể có tác động tích cực đối với sức khỏe, đặc biệt là đối với tâm trí và cơ thể. Nghiên cứu đã chỉ ra rằng âm nhạc có thể giảm căng thẳng, cải thiện tâm trạng và thậm chí làm giảm đau đớn. Nó cũng có thể đóng vai trò trong việc điều trị các tình trạng sức khỏe tâm thần và thể chất khác nhau.

5. Gắn kết xã hội: Âm nhạc có thể là một công cụ mạnh mẽ để gắn kết xã hội, cho phép mọi người kết nối với nhau thông qua trải nghiệm chung về âm nhạc. Nó có thể tạo ra cảm giác cộng đồng và sự đoàn kết, đặc biệt là trong các sự kiện hoặc lễ hội âm nhạc.

6. Nhận thức và sáng tạo: Âm nhạc cũng có thể ảnh hưởng đến nhận thức và chức năng nhận thức. Nó có thể kích thích sự sáng tạo, giúp mọi người suy nghĩ linh hoạt hơn và giải quyết vấn đề.

Tóm lại, âm nhạc có thể có tác động sâu sắc và đa mặt đối với con người",347.80608201026917,NVIDIA GeForce RTX 3060 Laptop GPU
