query,result,inference_time,device
"Sau khi tốt nghiệp Đại học FPT, sinh viên có thực sự là tìm được việc làm ngay hay không?","{'query': 'Sau khi tốt nghiệp Đại học FPT, sinh viên có thực sự là tìm được việc làm ngay hay không?', 'result': '\nKhông chắc rằng sinh viên Đại học FPT sẽ tìm được việc làm ngay sau khi tốt nghiệp. Tuy nhiên, họ sẽ có lợi thế là có được kiến thức và kinh nghiệm thực tế thông qua chương trình đào tạo, điều này có thể giúp họ tìm được việc làm.'}",43.46143412590027,NVIDIA GeForce RTX 3060 Laptop GPU
Vụ Nổ Lớn (Big Bang) có thực sự xảy ra?,"{'query': 'Vụ Nổ Lớn (Big Bang) có thực sự xảy ra?', 'result': '\nBig Bang là một mô hình được chấp nhận rộng rãi trong khoa học về sự hình thành và tiến hóa của vũ trụ. Nó mô tả vũ trụ bắt đầu như một điểm nóng, dày đặc, và qua thời gian mở rộng và làm lạnh, cuối cùng hình thành các hạt hạ nguyên tử, hạt nhân nguyên tử, và cuối cùng là các thiên hà và ngôi sao mà chúng ta quan sát ngày nay. Mô hình này được hỗ trợ bởi một lượng lớn bằng chứng, bao gồm bức xạ nền vi sóng vũ trụ, phân bố của các nguyên tố ánh sáng, và sự quan sát về các thiên hà và cụm thiên hà xa xôi.\n\nMặc dù có nhiều bằng chứng ủng hộ Big Bang, nhưng nó không phải là một sự thật tuyệt đối. Giống như bất kỳ lý thuyết khoa học nào, nó là một lý thuyết có thể được sửa đổi hoặc thay thế nếu có thêm bằng chứng mới. Tuy nhiên, với lượng bằng chứng hiện tại, Big Bang là mô hình tốt nhất chúng ta có về nguồn gốc và sự tiến hóa của vũ trụ.'}",145.9534206390381,NVIDIA GeForce RTX 3060 Laptop GPU
Triết lý đào tạo của đại học FPT là gì?,"{'query': 'Triết lý đào tạo của đại học FPT là gì?', 'result': '\nTriết lý đào tạo của Đại học FPT là ""đào tạo là tổ chức và quản trị việc tự học của người học"".'}",22.214650630950928,NVIDIA GeForce RTX 3060 Laptop GPU
Tập đoàn FPT được thành lập như thế nào?,"{'query': 'Tập đoàn FPT được thành lập như thế nào?', 'result': '\nTập đoàn Công nghệ FPT, thường được gọi là Tập đoàn FPT, được thành lập vào ngày 13 tháng 3 năm1988 bởi ông Trương Đình Quảng.'}",25.28987145423889,NVIDIA GeForce RTX 3060 Laptop GPU
Ngành học nào phổ biến nhất tại đại học FPT?,"{'query': 'Ngành học nào phổ biến nhất tại đại học FPT?', 'result': '\nNgành học phổ biến nhất tại Đại học FPT là Công nghệ thông tin.'}",15.653576612472534,NVIDIA GeForce RTX 3060 Laptop GPU
Thiết lượng tử ánh sáng là gì?,"{'query': 'Thiết lượng tử ánh sáng là gì?', 'result': '\nXin lỗi, nhưng không có đủ thông tin để cung cấp câu trả lời cho câu hỏi của bạn. Vui lòng cung cấp thêm ngữ cảnh hoặc làm rõ câu hỏi của bạn.'}",28.550880908966064,NVIDIA GeForce RTX 3060 Laptop GPU
Thông tin về ông Trương Gia Bình?,"{'query': 'Thông tin về ông Trương Gia Bình?', 'result': '\nÔng Trương Gia Bình là một doanh nhân và nhà giáo dục người Việt Nam. Ông là Chủ tịch hiện tại của Tập đoàn FPT, một trong những tập đoàn công nghệ lớn nhất Việt Nam. Trước đó, ông đã từng là Chủ tịch Hội đồng quản trị từ năm 2006 đến 2011, và sau đó là Phó Chủ tịch cho đến nay. Ông cũng là người sáng lập Viện Quản trị và Công nghệ FSB, và là người sáng lập Trường Cao đẳng FPT Polytechnic.'}",67.10414242744446,NVIDIA GeForce RTX 3060 Laptop GPU
Cái lược là cái gì?,"{'query': 'Cái lược là cái gì?', 'result': '\nCái lược là một công cụ được sử dụng để sắp xếp, phân chia và giữ cố định tóc, thường được sử dụng để tạo kiểu tóc hoặc giữ tóc ra khỏi mặt. Nó bao gồm một khung hoặc khung kim loại, thường có răng hoặc móc, và thường được trang trí bằng đá hoặc các vật liệu khác. Người có thể sử dụng lược để tạo ra các kiểu tóc khác nhau, giữ tóc gọn gàng và sạch sẽ, hoặc loại bỏ rối bằng cách nhẹ nhàng kéo hoặc đánh răng lược qua tóc.'}",73.56186866760254,NVIDIA GeForce RTX 3060 Laptop GPU
APICTA Awards là giải thưởng gì?,"{'query': 'APICTA Awards là giải thưởng gì?', 'result': '\nAPICTA Awards, viết tắt của Giải thưởng CNTT Châu Á – Thái Bình Dương, là một giải thưởng công nhận các ứng dụng, sản phẩm, giải pháp, dịch vụ phần mềm và CNTT xuất sắc trong khu vực Châu Á – Thái Bình Dương.'}",40.35660481452942,NVIDIA GeForce RTX 3060 Laptop GPU
Một ngày nên uống bao nhiêu nước?,"{'query': 'Một ngày nên uống bao nhiêu nước?', 'result': '\nNhu cầu nước của mỗi người có thể khác nhau, nhưng hướng dẫn chung là uống khoảng 2-3 lít nước mỗi ngày, tùy thuộc vào các yếu tố như tuổi, cân nặng, mức độ hoạt động và khí hậu. Điều quan trọng là giữ cơ thể đủ nước để duy trì chức năng tối ưu và sức khỏe.'}",44.300203800201416,NVIDIA GeForce RTX 3060 Laptop GPU
